{"schemaVersion":"1","executionId":"execution-fixture","profileId":"fixture-profile","provider":"codex","providerVersion":"fixture","status":"complete","usageStatus":"unavailable","phases":[],"totals":{"input":null,"cachedInput":null,"uncachedInput":null,"output":null,"reasoning":null},"turns":null,"toolCalls":null,"workers":null,"compactions":null,"rawTraceRetained":false,"parseErrors":0}
